{
  "schema": "qnfo-paper-provenance/1",
  "slug": "the-exponential-arena-a-reconciled-quantitative-account-of-hilbert-space-growth-",
  "paper": {
    "path": "papers/the-exponential-arena-a-reconciled-quantitative-account-of-hilbert-space-growth-/paper.md",
    "title": "The Exponential Arena: A Reconciled Quantitative Account of Hilbert-Space Growth with Qubit Number",
    "url": "https://papers.qnfo.org/papers/the-exponential-arena-a-reconciled-quantitative-account-of-hilbert-space-growth-"
  },
  "declared": {
    "version": null,
    "license": "QNFO-ULA v2.0 (CC BY-NC-SA 4.0 with the QNFO Supplemental Terms, https://legal.qnfo.org/)",
    "dois": []
  },
  "runs": [
    {
      "path": "runs/cycle-41/the-exponential-arena-a-reconciled-quantitative-account-of-hilbert-space-growth-",
      "relation": "produced-by",
      "match": "slug-exact",
      "manifest_sha256": null
    }
  ],
  "identifiers": {
    "research_queue_ids": [],
    "living_paper_slug": "the-exponential-arena-a-reconciled-quantitative-account-of-hilbert-space-growth-"
  },
  "snapshots": [
    {
      "sha256": "863b070266fb5bca34359be2d38ee8b5f8136b9c939fcfd24a2de8f06181aa45",
      "bytes": 28505,
      "recorded_at": "2026-10-26",
      "basis": "restore",
      "version": "1.0.0",
      "git_commit": null
    }
  ],
  "events": [
    {
      "event": "restored",
      "at": "2026-10-26",
      "detail": "paper text restored from living-paper"
    }
  ]
}
