{
  "schema": "qnfo-paper-provenance/1",
  "slug": "the-bruhat-tits-tree-as-a-unifying-computational-primitive-confluence-quantum-wa",
  "paper": {
    "path": "papers/the-bruhat-tits-tree-as-a-unifying-computational-primitive-confluence-quantum-wa/paper.md",
    "title": "The Bruhat–Tits Tree as a Unifying Computational Primitive: Confluence, Quantum Walks, and Tree‑Distance Attention",
    "url": "https://papers.qnfo.org/papers/the-bruhat-tits-tree-as-a-unifying-computational-primitive-confluence-quantum-wa"
  },
  "declared": {
    "version": null,
    "license": "QNFO-ULA v2.0 (CC BY-NC-SA 4.0 with the QNFO Supplemental Terms, https://legal.qnfo.org/)",
    "dois": []
  },
  "runs": [],
  "identifiers": {
    "research_queue_ids": [],
    "living_paper_slug": "the-bruhat-tits-tree-as-a-unifying-computational-primitive-confluence-quantum-wa"
  },
  "snapshots": [
    {
      "sha256": "5ccb7c618c728675b64118bd2417cfa275a48ed12ca85103c30343254a9fdb1e",
      "bytes": 24056,
      "recorded_at": "2026-10-26",
      "basis": "deposit",
      "version": "1.0.0",
      "git_commit": null
    }
  ],
  "events": []
}
