{
  "schema": "qnfo-paper-provenance/1",
  "slug": "cocycle-solving-in-cognition-ultrametric-reaction-times-and-analogy-depth",
  "paper": {
    "path": "silent-radix/cocycle-solving-in-cognition-ultrametric-reaction-times-and-analogy-depth/paper.md",
    "title": "Cocycle Solving in Cognition: Ultrametric Reaction Times and Analogy Depth",
    "url": "https://papers.qnfo.org/papers/cocycle-solving-in-cognition-ultrametric-reaction-times-and-analogy-depth"
  },
  "declared": {
    "version": null,
    "license": "QNFO-ULA v2.0 (CC BY-NC-SA 4.0 with the QNFO Supplemental Terms, https://legal.qnfo.org/)",
    "dois": []
  },
  "runs": [],
  "identifiers": {
    "research_queue_ids": [],
    "living_paper_slug": "cocycle-solving-in-cognition-ultrametric-reaction-times-and-analogy-depth"
  },
  "snapshots": [
    {
      "sha256": "f072478fe16ce7852306d0797717b266d1d4bf7def17e7070b0d9dda87757376",
      "bytes": 20878,
      "recorded_at": "2026-10-26",
      "basis": "deposit",
      "version": "1.0.1",
      "git_commit": null
    }
  ],
  "events": []
}
